{
  "tool_version": "0.36.1",
  "tool_sha256": "1b8d1c54ebc53f5be9b850decda5739ad04becbe9109f01514c3edf214adace3",
  "spec_name": "iris-species",
  "spec_version": "0.1.0",
  "spec_sha256": "b6443a36d9d3b0e15c9885a555de15cfffc25e25a646884f4f4d460787b6bc60",
  "data_sha256": "153c4dcefb332e38221e8a27b3f46b179d6dbf46ef834bbd87e188b0acda5942",
  "provider": "dry",
  "model": "dry-bravo",
  "seed": 42,
  "n_items": 149,
  "repeats": 1,
  "dry_run": true,
  "budget_cap_usd": 0.0,
  "rate_in_per_mtok": 0.0,
  "rate_out_per_mtok": 0.0,
  "witness_report": {
    "n_witnesses": 7,
    "n_behaved": 7,
    "verdict": "validated"
  },
  "env": {
    "python": "3.13.14",
    "platform": "Windows-11-10.0.26200-SP0",
    "packages": {
      "dinostomp": "0.29.0",
      "jsonschema": "4.25.1",
      "PyYAML": "6.0.2"
    }
  },
  "started_at": "2026-08-09T10:05:41.539447+00:00",
  "status": "complete",
  "model_reported": "dry-bravo",
  "spend_usd": 0.0,
  "spend_source": "metered",
  "finished_at": "2026-08-09T10:05:41.698181+00:00",
  "run_file": "20260809_100541_iris-species_dry-bravo_n149_s42.jsonl"
}