{
  "tool_version": "0.29.0",
  "tool_sha256": "e61a7157ccdb2867e3d05e4f1567f81b53b573f72d6ab66d5589ab30742cabbb",
  "spec_name": "bench-gsm8k",
  "spec_version": "0.1.0",
  "spec_sha256": "0a43b2c953404b6768ed9d552f7decf2e4fe2fac5e084438900e57607ba25207",
  "data_sha256": "a0917cec62a9d75e589e7ce559c88eaec8fe0cae1eb33f5aecdfa89df1935a55",
  "provider": "openrouter",
  "model": "meta-llama/llama-3.1-8b-instruct",
  "seed": 23,
  "n_items": 120,
  "repeats": 1,
  "dry_run": false,
  "budget_cap_usd": 0.4,
  "rate_in_per_mtok": 0.05,
  "rate_out_per_mtok": 0.08,
  "witness_report": {
    "n_witnesses": 6,
    "n_behaved": 6,
    "verdict": "validated"
  },
  "env": {
    "python": "3.13.14",
    "platform": "Windows-11-10.0.26200-SP0",
    "packages": {
      "dinostomp": "0.29.0",
      "jsonschema": "4.25.1",
      "PyYAML": "6.0.2"
    }
  },
  "started_at": "2026-08-09T03:52:51.593256+00:00",
  "status": "complete",
  "model_reported": "meta-llama/llama-3.1-8b-instruct",
  "spend_usd": 0.00241986,
  "spend_source": "metered",
  "finished_at": "2026-08-09T04:03:15.713758+00:00",
  "run_file": "20260809_035251_bench-gsm8k_meta-llama-llama-3.1-8b-instruct_n120_s23.jsonl"
}