{
  "tool_version": "0.36.2",
  "tool_sha256": "af609d364f0464936f8d3891f11bcb60d53dcf10e04785c73c43f887310b918d",
  "spec_name": "fleet-arith",
  "spec_version": "0.1.0",
  "spec_sha256": "cc280622dc0f91aa3809e0072bf4125add1a99825319f4f97a681fb4e23657cc",
  "data_sha256": "742d30fda48436edace090596fe7659588d02761e788be1acdd3fbf2573437dd",
  "provider": "dry",
  "model": "dry-bravo",
  "seed": 42,
  "n_items": 24,
  "repeats": 1,
  "dry_run": true,
  "budget_cap_usd": 0.0,
  "rate_in_per_mtok": 0.0,
  "rate_out_per_mtok": 0.0,
  "witness_report": {
    "n_witnesses": 5,
    "n_behaved": 5,
    "verdict": "validated"
  },
  "env": {
    "python": "3.13.14",
    "platform": "Windows-11-10.0.26200-SP0",
    "packages": {
      "dinostomp": "0.29.0",
      "jsonschema": "4.25.1",
      "PyYAML": "6.0.2"
    }
  },
  "started_at": "2026-08-09T10:16:17.919903+00:00",
  "status": "complete",
  "model_reported": "dry-bravo",
  "spend_usd": 0.0,
  "spend_source": "metered",
  "finished_at": "2026-08-09T10:16:17.950488+00:00",
  "run_file": "20260809_101617_fleet-arith_dry-bravo_n24_s42.jsonl"
}