{
  "tool_version": "0.35.1",
  "tool_sha256": "d25f10ee73f4a7346c740443ded2ee4acb9430ea2bca5f80486230a4d0360a7d",
  "spec_name": "agent-capitals",
  "spec_version": "0.1.0",
  "spec_sha256": "17c54444cea01945ce7b27216b8726a7512c336a18554774705ff9ce98abc461",
  "data_sha256": "5dfd19b1348d90405cd81c07540d53a4583e766dfbb690420cf78bdeb5cb530c",
  "provider": "python",
  "model": "agent-partial",
  "seed": 42,
  "n_items": 26,
  "repeats": 1,
  "dry_run": false,
  "budget_cap_usd": 0.0,
  "rate_in_per_mtok": 0.0,
  "rate_out_per_mtok": 0.0,
  "witness_report": {
    "n_witnesses": 5,
    "n_behaved": 5,
    "verdict": "validated"
  },
  "env": {
    "python": "3.13.14",
    "platform": "Windows-11-10.0.26200-SP0",
    "packages": {
      "dinostomp": "0.29.0",
      "jsonschema": "4.25.1",
      "PyYAML": "6.0.2"
    }
  },
  "started_at": "2026-08-09T08:32:07.210593+00:00",
  "status": "complete",
  "target_sha256": "56f6fd64ffda736e33f3c48b5232b8b9a13f071c4a13c343f961e021da40694c",
  "model_reported": "agent-partial",
  "spend_usd": 0.0,
  "spend_source": "metered",
  "finished_at": "2026-08-09T08:32:07.246903+00:00",
  "run_file": "20260809_083207_agent-capitals_agent-partial_n26_s42.jsonl"
}