{
  "tool_version": "0.36.1",
  "tool_sha256": "1b8d1c54ebc53f5be9b850decda5739ad04becbe9109f01514c3edf214adace3",
  "spec_name": "smoke-arith",
  "spec_version": "0.1.0",
  "spec_sha256": "fca7dbcadb153b3133b04982dca162ac942495b32d1738505fb5f91e560219a9",
  "data_sha256": "0b56432c320054896104625b1a31ce453976ad63564baa96c5571ce414c9b623",
  "provider": "dry",
  "model": "dry-strong",
  "seed": 42,
  "n_items": 6,
  "repeats": 1,
  "dry_run": true,
  "budget_cap_usd": 0.0,
  "rate_in_per_mtok": 0.0,
  "rate_out_per_mtok": 0.0,
  "witness_report": {
    "n_witnesses": 5,
    "n_behaved": 5,
    "verdict": "validated"
  },
  "env": {
    "python": "3.13.14",
    "platform": "Windows-11-10.0.26200-SP0",
    "packages": {
      "dinostomp": "0.29.0",
      "jsonschema": "4.25.1",
      "PyYAML": "6.0.2"
    }
  },
  "started_at": "2026-08-09T10:05:39.154650+00:00",
  "status": "complete",
  "model_reported": "dry-strong",
  "spend_usd": 0.0,
  "spend_source": "metered",
  "finished_at": "2026-08-09T10:05:39.164125+00:00",
  "run_file": "20260809_100539_smoke-arith_dry-strong_n6_s42.jsonl"
}