{
  "tool_version": "0.52.0",
  "tool_sha256": "d9ec4738f87d215450ef39b50d3db7163e9f1936c50a91eb28e56f2db23ae3c4",
  "spec_name": "judge-capitals",
  "spec_version": "0.1.0",
  "spec_sha256": "414280db41465402b15aef657631b3c41dea335c4b29ee7de348d500cdc5c58d",
  "data_sha256": "ceb8609c45e8daed58a6ca30757e45bbce202303e6cb1c8324b741d2e11b24d4",
  "provider": "dry",
  "model": "judge-control",
  "seed": 42,
  "n_items": 128,
  "dry_run": true,
  "budget_cap_usd": 0.0,
  "rate_in_per_mtok": 0.0,
  "rate_out_per_mtok": 0.0,
  "witness_report": {
    "n_witnesses": 6,
    "n_behaved": 6,
    "verdict": "validated"
  },
  "env": {
    "python": "3.13.14",
    "platform": "Windows-11-10.0.26200-SP0",
    "packages": {
      "dinostomp": "0.29.0",
      "jsonschema": "4.25.1",
      "PyYAML": "6.0.2"
    }
  },
  "probe": "judge",
  "started_at": "2026-08-10T03:35:27.859594+00:00",
  "status": "complete",
  "spend_usd": 0.0,
  "spend_source": "metered",
  "judge_calls": 134,
  "finished_at": "2026-08-10T03:35:27.993928+00:00",
  "run_file": "20260810_033527_judge-capitals_judge-control_n8-judgeprobe_s42.jsonl"
}